Center Name,Address,Contact Details,Doctor Details,Google Maps Link,Reasoning
"Sai hospital C. T. Scan and Diagnosis center","R8V9+635, Sachin Layout, Narsala, Nagpur, Umred, Maharashtra 441203, India.","Not provided in the text.","","https://www.google.com/maps/search/?api=1&query=Sai+hospital+C.+T.+Scan+and+Diagnosis+center+R8V9%2B635%2C+Sachin+Layout%2C+Narsala%2C+Nagpur%2C+Umred%2C+Maharashtra+441203%2C+India.","The center's name includes 'C. T. Scan' and its services list specifies 'various types of CT scans'."
"STAR IMAGING & DIAGNOSTICS, 3T MRI CENTRE","Midas Heights, 7, Central Bazar Road, Ramdaspeth, Nagpur, Maharashtra 440010","086000 10686","","https://www.google.com/maps/search/?api=1&query=STAR+IMAGING+%26+DIAGNOSTICS%2C+3T+MRI+CENTRE+Midas+Heights%2C+7%2C+Central+Bazar+Road%2C+Ramdaspeth%2C+Nagpur%2C+Maharashtra+440010","The description of services provided by the center explicitly includes 'CT scans'."
"CT scan center","Above Pongade Orthopedic Hospital, Nagpur, X693+4FJ, Bypass Road, Umred, Maharashtra 441204, India","Not available.","","https://www.google.com/maps/search/?api=1&query=CT+scan+center+Above+Pongade+Orthopedic+Hospital%2C+Nagpur%2C+X693%2B4FJ%2C+Bypass+Road%2C+Umred%2C+Maharashtra+441204%2C+India","The center's name itself indicates that it provides CT scans, as stated in the text."
"VAISHALI (SURE TECH) CT & MRI SCAN CENTER","Dhantoli, Nagpur, Maharashtra 440012, India.","089561 50642","","https://www.google.com/maps/search/?api=1&query=VAISHALI+%28SURE+TECH%29+CT+%26+MRI+SCAN+CENTER+Dhantoli%2C+Nagpur%2C+Maharashtra+440012%2C+India.","The name of the center explicitly identifies it as a 'CT & MRI SCAN CENTER'."
"KIMS-Kingsway Hospitals","SPANV Medisearch Lifesciences Pvt. Ltd, 44, Kingsway Rd, near Kasturchand Park, Mohan Nagar, Nagpur, Maharashtra 440001, India","0712 678 9100","","https://www.google.com/maps/search/?api=1&query=KIMS-Kingsway+Hospitals+SPANV+Medisearch+Lifesciences+Pvt.+Ltd%2C+44%2C+Kingsway+Rd%2C+near+Kasturchand+Park%2C+Mohan+Nagar%2C+Nagpur%2C+Maharashtra+440001%2C+India","The text confirms the hospital's Radiology and Medical Imaging department includes ""Body CT"" and a new 128-slice CT scanner."
"Arihant Multispeciality Hospital","43MW+VQ5 Baidyanath Sqr, opp. capitol heights, opp. VRmall, Untkhana, Nagpur, Maharashtra 440024, India","0712 665 6666","","https://www.google.com/maps/search/?api=1&query=Arihant+Multispeciality+Hospital+43MW%2BVQ5+Baidyanath+Sqr%2C+opp.+capitol+heights%2C+opp.+VRmall%2C+Untkhana%2C+Nagpur%2C+Maharashtra+440024%2C+India","The text explicitly states that the hospital lists ""Multi Slice CT Scan"" as part of its Advanced Radiology Services."
"HORIZON IMAGING AND DIAGNOSTICS","B/13, Ground Floor, Neelgagan Cooperative Housing Society, Besides RNH Hospital, Balraj Marg, Dhantoli, Nagpur, Maharashtra 440012, India.","082912 04472","","https://www.google.com/maps/search/?api=1&query=HORIZON+IMAGING+AND+DIAGNOSTICS+B%2F13%2C+Ground+Floor%2C+Neelgagan+Cooperative+Housing+Society%2C+Besides+RNH+Hospital%2C+Balraj+Marg%2C+Dhantoli%2C+Nagpur%2C+Maharashtra+440012%2C+India.","The text explicitly states that this center is 'confirmed to have Computed Tomography (CT) scan facilities'."
"Dr Dinesh Singh | KK Spiral CT Scan","3-4 Paramanand Apartment, Opposite Indora Police Station Metro Pillar No- 104, Indora chowk, Kamptee Rd, Nagpur, Maharashtra 440017, India.","+91 712 264 5315","Dr Dinesh Singh","https://www.google.com/maps/search/?api=1&query=Dr+Dinesh+Singh+|+KK+Spiral+CT+Scan+3-4+Paramanand+Apartment,+Opposite+Indora+Police+Station+Metro+Pillar+No-+104,+Indora+chowk,+Kamptee+Rd,+Nagpur,+Maharashtra+440017,+India.","The center's name and its listed services both confirm the availability of a 'Spiral CT Scan'."